query,response,answer
. what is a corporation?,"A corporation is a business organization chartered by a state, recognized as a legal entity separate from its owners, with rights and liabilities distinct from those of its members.",A corporation is a company or group of people authorized to act as a single entity and recognized as such in law.
why did rachel carson write an obligation to endure,"Rachel Carson wrote ""The Obligation to Endure"" to highlight the dangers of excessive chemical use and argue for the public's right to know about these risks. The essay aims to inform and persuade readers of the urgent need to address environmental pollution.","Rachel Carson writes The Obligation to Endure because believes that as man tries to eliminate unwanted insects and weeds, however he is actually causing more problems by polluting the environment."
why did the progressive movement fail to advance racial equality quizlet,"The Progressive Movement largely failed to advance racial equality because many progressives were motivated by other social reforms and often overlooked or ignored the issues faced by African Americans, including segregation and disenfranchisement. Additionally, some progressive leaders, like Wilson, may have been influenced by their personal biases or feared political repercussions from addressing racial inequality directly.",No Answer Present.
why do police need to understand what the forensic scientists do,"Police need to understand what forensic scientists do to properly collect and preserve evidence at crime scenes, ensuring it can be effectively analyzed and used in legal proceedings. This collaboration ensures that the scientific methods and technologies are correctly applied to aid in solving crimes.",No Answer Present.
do owls eat in the day,"Owls primarily hunt at night, but some species like the snowy owl and northern hawk-owl can hunt during the day. Most owls eat small mammals, birds, and insects, whether hunting nocturnally or diurnally.",No Answer Present.
symptoms of a dying mouse,"Signs that a mouse may be dying include respiratory arrest (no breathing), cardiac arrest (no pulse), pallor mortis (paleness 15–120 minutes after death), and livor mortis (settling of blood in the lower body part). Other symptoms can include lethargy, hunched posture, ruffled fur, and lack of response to stimuli.","The symptoms of a dying mouse are runny eyes, sneezing, wheezing, shaking, fluctuating body temperature, tiredness, loss of appetite, and dull coat."
average number of lightning strikes per day,"The average number of lightning strikes per day globally is around 8,640,000.","Globally 8,640,000 lightning strikes per day."
can you burn your lawn with fertilizer,"Yes, you can burn your lawn with fertilizer if you overapply or apply it incorrectly, leading to salt buildup that draws moisture out of the grass. Proper application according to the specific needs of your grass type and conditions is crucial to avoid this issue.","Yes, over fertilizing can burn lawn."
are volvox autotrophic or heterotrophic,"Volvox are autotrophic, capable of producing their own food through photosynthesis. This is evident from their classification as green algae and their involvement in photosynthetic processes.",No Answer Present.
average force of a raindrop,No Answer Present,No Answer Present.
